{"artifacts": [], "budget": {"correctiveRoundsRemaining": 3, "timeboxMinutes": 25}, "changeId": "demo-change", "correctiveRoundsUsed": 0, "external": {"implPrs": [], "issueState": null, "issueUrl": null, "specBranch": null, "specPr": null}, "governance": {"gaps": [], "sources": []}, "issueId": "LIN-1", "maxCorrectiveRounds": 3, "nextAction": "preflight", "phase": "intake", "runId": "demo-1", "schemaVersion": "1", "skills": [], "updatedAt": "2026-09-08T00:00:00+00:00", "verification": {"history": [], "lastCodeHash": null, "lastVerifiedHash": null, "plan": [], "stale": false}, "worktree": {"allowedScope": ["pkg/a"], "baseRef": "main", "baseSha": "abcdef0", "branch": "lin-1-demo", "repositoryId": "acme/web", "root": "/tmp/wt"}}
